{
  "schema_version": "1.0.0",
  "description": "Candidate fixed facts excluded from automatic Day Zero conversion pending human review.",
  "method": "Conservative deterministic classification: bare years, case-citation years, and dates in statutory/effective-date context are held out.",
  "summary": {
    "count": 674,
    "by_reason": {
      "bare year is a fixed-fact candidate": 579,
      "statutory/effective-date context is a fixed fact": 86,
      "case-citation year is a fixed fact": 9
    }
  },
  "entries": [
    {
      "source": "data/matters/m01-arbitration-meridian/exercise/exercise.json",
      "locator": "b:9cd01e61:year:70",
      "literal": "2014",
      "reason": "bare year is a fixed-fact candidate",
      "review_status": "candidate_pending_human_review"
    },
    {
      "source": "data/matters/m01-arbitration-meridian/exercise/exercise.json",
      "locator": "b:9cd01e61:year:141",
      "literal": "2024",
      "reason": "bare year is a fixed-fact candidate",
      "review_status": "candidate_pending_human_review"
    },
    {
      "source": "data/matters/m01-arbitration-meridian/case-file/exh-002-notice-of-discharge.md",
      "locator": "b:dd865992:0",
      "literal": "October 15, 2025",
      "reason": "statutory/effective-date context is a fixed fact",
      "review_status": "candidate_pending_human_review"
    },
    {
      "source": "data/matters/m01-arbitration-meridian/case-file/exh-002-notice-of-discharge.md",
      "locator": "b:e93ce801:year:198",
      "literal": "2024",
      "reason": "bare year is a fixed-fact candidate",
      "review_status": "candidate_pending_human_review"
    },
    {
      "source": "data/matters/m01-arbitration-meridian/case-file/exh-005-personnel-file.md",
      "locator": "b:56b5abb7:year:2",
      "literal": "2016",
      "reason": "bare year is a fixed-fact candidate",
      "review_status": "candidate_pending_human_review"
    },
    {
      "source": "data/matters/m01-arbitration-meridian/case-file/exh-005-personnel-file.md",
      "locator": "b:56b5abb7:year:7",
      "literal": "2023",
      "reason": "bare year is a fixed-fact candidate",
      "review_status": "candidate_pending_human_review"
    },
    {
      "source": "data/matters/m01-arbitration-meridian/case-file/exh-005-personnel-file.md",
      "locator": "b:a62820b7:year:97",
      "literal": "2019",
      "reason": "bare year is a fixed-fact candidate",
      "review_status": "candidate_pending_human_review"
    },
    {
      "source": "data/matters/m01-arbitration-meridian/case-file/exh-005-personnel-file.md",
      "locator": "b:a62820b7:year:103",
      "literal": "2022",
      "reason": "bare year is a fixed-fact candidate",
      "review_status": "candidate_pending_human_review"
    },
    {
      "source": "data/matters/m01-arbitration-meridian/case-file/exh-005-personnel-file.md",
      "locator": "b:5638a487:year:66",
      "literal": "2014",
      "reason": "bare year is a fixed-fact candidate",
      "review_status": "candidate_pending_human_review"
    },
    {
      "source": "data/matters/m01-arbitration-meridian/case-file/exh-005-personnel-file.md",
      "locator": "b:5638a487:year:85",
      "literal": "2024",
      "reason": "bare year is a fixed-fact candidate",
      "review_status": "candidate_pending_human_review"
    },
    {
      "source": "data/matters/m01-arbitration-meridian/case-file/exh-005-personnel-file.md",
      "locator": "b:5638a487:year:111",
      "literal": "2023",
      "reason": "bare year is a fixed-fact candidate",
      "review_status": "candidate_pending_human_review"
    },
    {
      "source": "data/matters/m01-arbitration-meridian/case-file/exh-005-personnel-file.md",
      "locator": "b:5638a487:year:151",
      "literal": "2024",
      "reason": "bare year is a fixed-fact candidate",
      "review_status": "candidate_pending_human_review"
    },
    {
      "source": "data/matters/m01-arbitration-meridian/case-file/exh-005-personnel-file.md",
      "locator": "b:5638a487:year:364",
      "literal": "2024",
      "reason": "bare year is a fixed-fact candidate",
      "review_status": "candidate_pending_human_review"
    },
    {
      "source": "data/matters/m01-arbitration-meridian/case-file/statement-bexley.md",
      "locator": "b:1a2f5961:year:511",
      "literal": "2024",
      "reason": "bare year is a fixed-fact candidate",
      "review_status": "candidate_pending_human_review"
    },
    {
      "source": "data/matters/m01-arbitration-meridian/case-file/statement-bexley.md",
      "locator": "b:34b9ee18:year:113",
      "literal": "2023",
      "reason": "bare year is a fixed-fact candidate",
      "review_status": "candidate_pending_human_review"
    },
    {
      "source": "data/matters/m01-arbitration-meridian/case-file/statement-bexley.md",
      "locator": "b:34b9ee18:year:168",
      "literal": "2024",
      "reason": "bare year is a fixed-fact candidate",
      "review_status": "candidate_pending_human_review"
    },
    {
      "source": "data/matters/m01-arbitration-meridian/case-file/statement-osgard.md",
      "locator": "b:25e95268:year:147",
      "literal": "2014",
      "reason": "bare year is a fixed-fact candidate",
      "review_status": "candidate_pending_human_review"
    },
    {
      "source": "data/matters/m01-arbitration-meridian/case-file/statement-osgard.md",
      "locator": "b:f4f772ca:year:9",
      "literal": "2024",
      "reason": "bare year is a fixed-fact candidate",
      "review_status": "candidate_pending_human_review"
    },
    {
      "source": "data/matters/m01-arbitration-meridian/case-file/statement-osgard.md",
      "locator": "b:42424b2f:year:456",
      "literal": "2024",
      "reason": "bare year is a fixed-fact candidate",
      "review_status": "candidate_pending_human_review"
    },
    {
      "source": "data/matters/m01-arbitration-meridian/case-file/statement-rennick.md",
      "locator": "b:114b2a94:year:78",
      "literal": "2024",
      "reason": "bare year is a fixed-fact candidate",
      "review_status": "candidate_pending_human_review"
    },
    {
      "source": "data/matters/m01-arbitration-meridian/case-file/statement-rennick.md",
      "locator": "b:98ad730e:year:27",
      "literal": "2024",
      "reason": "bare year is a fixed-fact candidate",
      "review_status": "candidate_pending_human_review"
    },
    {
      "source": "data/matters/m01-arbitration-meridian/exercise/answer-key.md",
      "locator": "b:08dff12d:year:121",
      "literal": "2023",
      "reason": "bare year is a fixed-fact candidate",
      "review_status": "candidate_pending_human_review"
    },
    {
      "source": "data/matters/m01-arbitration-meridian/exercise/answer-key.md",
      "locator": "b:08dff12d:year:231",
      "literal": "2023",
      "reason": "bare year is a fixed-fact candidate",
      "review_status": "candidate_pending_human_review"
    },
    {
      "source": "data/matters/m01-arbitration-meridian/exercise/answer-key.md",
      "locator": "b:08dff12d:year:270",
      "literal": "2024",
      "reason": "bare year is a fixed-fact candidate",
      "review_status": "candidate_pending_human_review"
    },
    {
      "source": "data/matters/m01-arbitration-meridian/exercise/answer-key.md",
      "locator": "b:ebb88c60:year:16",
      "literal": "2024",
      "reason": "bare year is a fixed-fact candidate",
      "review_status": "candidate_pending_human_review"
    },
    {
      "source": "data/matters/m01-arbitration-meridian/exercise/answer-key.md",
      "locator": "b:ebb88c60:year:42",
      "literal": "2024",
      "reason": "bare year is a fixed-fact candidate",
      "review_status": "candidate_pending_human_review"
    },
    {
      "source": "data/matters/m01-arbitration-meridian/exercise/answer-key.md",
      "locator": "b:aaf745b2:year:402",
      "literal": "2024",
      "reason": "bare year is a fixed-fact candidate",
      "review_status": "candidate_pending_human_review"
    },
    {
      "source": "data/matters/m01-arbitration-meridian/exercise/answer-key.md",
      "locator": "b:2c3bfd54:year:407",
      "literal": "2024",
      "reason": "bare year is a fixed-fact candidate",
      "review_status": "candidate_pending_human_review"
    },
    {
      "source": "data/matters/m01-arbitration-meridian/exercise/answer-key.md",
      "locator": "b:6bae3144:year:178",
      "literal": "2024",
      "reason": "bare year is a fixed-fact candidate",
      "review_status": "candidate_pending_human_review"
    },
    {
      "source": "data/matters/m01-arbitration-meridian/exercise/answer-key.md",
      "locator": "b:46aae4aa:year:131",
      "literal": "2024",
      "reason": "bare year is a fixed-fact candidate",
      "review_status": "candidate_pending_human_review"
    },
    {
      "source": "data/matters/m01-arbitration-meridian/exercise/answer-key.md",
      "locator": "b:5996c51b:year:99",
      "literal": "2024",
      "reason": "bare year is a fixed-fact candidate",
      "review_status": "candidate_pending_human_review"
    },
    {
      "source": "data/matters/m01-arbitration-meridian/exercise/answer-key.md",
      "locator": "b:fdd0e6f1:year:206",
      "literal": "2024",
      "reason": "bare year is a fixed-fact candidate",
      "review_status": "candidate_pending_human_review"
    },
    {
      "source": "data/matters/m01-arbitration-meridian/exercise/answer-key.md",
      "locator": "b:b2a7baad:year:116",
      "literal": "2024",
      "reason": "bare year is a fixed-fact candidate",
      "review_status": "candidate_pending_human_review"
    },
    {
      "source": "data/matters/m01-arbitration-meridian/exercise/answer-key.md",
      "locator": "b:94a08df6:year:207",
      "literal": "2024",
      "reason": "bare year is a fixed-fact candidate",
      "review_status": "candidate_pending_human_review"
    },
    {
      "source": "data/matters/m01-arbitration-meridian/exercise/instructor-notes.md",